Unnamed: 0,reviewID,reviewContent,rating,usefulCount,coolCount,funnyCount,sentGroup,cleanReview,dominantTopic,topicLabel
2986,vURf9AGmThDrRC9TVcQrdw,"The good:  the view; location The bad:  service non-existent (or rude when you get someone's attention) Dirty, dingy, tired rooms (stains on sheets, walls, really foul) Cheap furniture Air conditioning erratic and LOUD Poor lighting (don't even try to shave in the bathroom); dimly lit elevators Constant barrage of music. Very dated atmosphere. So many better choices (and cheaper).",1,0,0,0,Negative,good view location bad service non existent rude someone attention dirty dingy tired room stain sheet wall really foul cheap furniture air conditioning erratic loud poor lighting even try shave bathroom dimly lit elevator constant barrage music dated atmosphere many better choice cheaper,1,Service Breakdown/Attitude
2992,KZPXFD-Db0XGgVta97Nzrg,"The location and the atmosphere of the hotel is nice,  The rooms were comfy and great view. However, the service is absolutely awful and unacceptable.It was hectic and chaotic and not what we would expect from a 4-star hotel, let alone the W. I am a frequent patron of the Starwood Family and this was absolutely dis-concerning. The concierges didn't even know the area, nor were they friendly or helpful. And when I finally dragged out of them a recommendation, it was probably the worst meal we ever had. He basically googled the restaurant that was closest to where we were going. Unacceptable.     The Acura car was never available and the spa was not enjoyable. The bar-tending staff was rude and slow. The elevator took forever and in a elevator conversation with another guest, they initiated the conversation on how disappointing this hotel was and chaotic and relaxing. So glad I was not the only one! I wouldn't return with all of the great hotels in Chicago.",1,0,0,0,Negative,location atmosphere nice room comfy great view however service absolutely awful unacceptable hectic chaotic expect star let alone frequent patron starwood family absolutely dis concerning concierge even know area friendly helpful finally dragged recommendation probably worst meal ever basically googled restaurant closest going unacceptable acura car never available spa enjoyable bar tending staff rude slow elevator took forever elevator conversation another guest initiated conversation disappointing chaotic relaxing glad return great hotel chicago,5,Price/Fees/Poor Value
3004,QyZQpwn6t31pOg9SSyO13Q,"First time staying @ a W and if they are all like this one, probably the last. Booked a 2 night stay here over the holidays to take advantage of their indoor pool and take the family out to downtown restaurants for a change. The room was tiny and so was the bathroom.  Unlike the Renaissance on Wacker which has 2 queen size beds and plenty of room, this place can only squeeze in two doubles and barely leave enough room to move around.  It's so bad, that they do not even have a luggage rack: no place to put it.  So basically you put your suitcase on a shelf just below where all your clothes would hand in their wall mounted organizer. The bathroom also lacks a real door.  We had a sliding bamboo door and shutters. I shit you not!  There are wooden shutters in a wall separating the main room from the bathroom. Front desk service here is a hit or miss as well.  Checking in, I said I did not have my Starwood card with me.  In most places they volunteer to look it up or provide some guidance to earn points after the fact.  Not here, she just ignored me.  Not a big deal, as I seldom stay @ Starwood properties; prefer Marriott and Hilton brands. Parking here is $53 a night, which is steep even by downtown standards.  If you are heading to Navy Pier, the location is great.  If you want Michigan Ave or the many restaurants 100E-500W, then you have a nice hike ahead of you.",2,2,0,0,Negative,first time staying probably last booked holiday take advantage indoor pool take family downtown restaurant change tiny bathroom unlike renaissance wacker queen size bed plenty squeeze two double barely leave enough move around bad even luggage rack put basically put suitcase shelf clothes hand wall mounted organizer bathroom lack real door sliding bamboo door shutter shit wooden shutter wall separating main bathroom front desk service hit miss well checking said starwood card place volunteer look provide guidance earn point fact ignored big deal seldom starwood property prefer marriott hilton brand parking steep even downtown standard heading navy pier location great want michigan ave many restaurant nice hike ahead,2,Cleanliness/Wear/Poor Upkeep
3017,MhW8UbJHOkLJrm9hvCkAZQ,Was truly  disapointed!! it has GREAT lake views and of navu pier as well but thats all it  has going for it. The rooms were okay - quite open concept with a window in the bathroom which opens up ito the bedroom - not sure why you need that? LOL! the lobby and hallways are dark and loud - the W way. We got carded at the bar upstairs and downstairs which was annoying - we were old enough to buy  a room there but not a drink! really?,2,0,0,0,Negative,truly disapointed great lake view navu pier well thats going room okay quite open concept window bathroom open ito bedroom sure need lol lobby hallway dark loud way got carded bar upstairs downstairs annoying old enough buy drink really,5,Price/Fees/Poor Value
3019,VSRoLj0,Pros - View of Lake Michigan - Food was solid combined with outdoor seating - Location - great location - close to Navy Pier & Michigan Ave Cons -Rooms/bathroom are small (even with upgrade) -Air-conditioning obscenely loud (according to the wife) -Rooms look dated but they tried hard to update them (Used to be an old Days Inn) -Wife thought the room smelled (1st room was smoky and we got switched; second room has carpet cleaner overkill) -Service was poor - specifically bell desk shuttling us a new key that never happened and I ultimately headed down there. Conrad & Blackstone are still my go-to properties in Chi-town. Still figuring out the best SPG option.,2,1,0,0,Negative,pro view lake michigan food solid combined outdoor seating location great location close navy pier michigan ave con room bathroom small even upgrade air conditioning obscenely loud according wife room look dated tried hard update used old day inn wife thought smelled smoky got switched second carpet cleaner overkill service poor specifically bell desk shuttling new key never happened ultimately headed conrad blackstone still property chi town still figuring best spg option,1,Service Breakdown/Attitude
3023,wxfgopuQejwJVxIr0ISh5g,"The service at the w is the worst. Checking in no porter or bell man. Checked in at the front desk and told the lady. She said would you like help with your bags. I said absolutely and told her no one was out front to help. Waited. No one shows up. I take them myself. Concierge is totally unhelpful and completely overwhelmed. The front desk, they live here but don't know where anything is. I just travel advisor it or google map it. Unreal. The wave restaurant is opposite. Food is delicious and service is excellent!!! Checking out, waited 25 minutes for luggage assistance and guess what no one shows up and again I take it downstairs myself. I tell the front desk again. They say they'll send someone up and again I bring the luggage down myself. Worst service in this hotel.",2,0,0,0,Negative,service worst checking porter bell man checked front desk told lady said help bag said absolutely told front help waited show take concierge totally unhelpful completely overwhelmed front desk live know anything travel advisor google map unreal wave restaurant opposite food delicious service excellent checking waited minute luggage assistance guess show take downstairs tell front desk say send someone bring luggage worst service,2,Cleanliness/Wear/Poor Upkeep
3026,hTlk5RyVr,"If you are a hot young thing from the suburbs on the make with no need for good bar service, try the lounge! If you are an adult who travels quite a bit and resents paying a substantial chunk of money to be treated like crap by the staff, try another hotel!",2,1,0,1,Negative,hot young thing suburb make need good bar service try lounge adult travel quite bit resents paying substantial chunk money treated crap staff try another,3,Design Flaws/Lack of Privacy
3027,AIFBFvotVaUy9d2d0UCshw,Bad service + dirty room with a super small bathroom + outdated techno music through out.,2,1,0,0,Negative,bad service dirty super small bathroom outdated techno music,2,Cleanliness/Wear/Poor Upkeep
3036,uHTUc42kTfgIAasD1STPTQ,"I felt like a sleeze in this place. It was not classy at all. It was like trashy trendy. The rooms are soooo beyond outdated and the wooden shutters that hide the bathroom from the rest of the room?...Ew.  Who in the world came up with that idea? Did they assume everyone would be married and totally turned on by the sights sounds and smells of each others bathroomtime? I was only here for my job but upon immediately finding out that the W was where we were planted, I reserved myself a completely different hotel and I'm glad. My coworker said she didnt sleep a wink that night because the AC was so freakin loud. Room service was terribly slow (60 min wait time) and the food arrived cold (should've known)...  The dessert with icecream on the side was totally melted.  They sent us back up new orders at no cost and the food was much faster/better that time. Thank goodness. I am glad I got to experience this place for free because it was about the same class as a trendied up days inn.",2,3,2,2,Negative,felt sleeze classy trashy trendy room soooo beyond outdated wooden shutter hide bathroom rest world came idea assume everyone married totally turned sight sound smell others bathroomtime job upon immediately finding planted reserved completely different glad coworker said didnt sleep wink freakin loud service terribly slow min wait time food arrived cold known dessert icecream side totally melted sent back new order cost food much faster better time thank goodness glad got experience free class trendied day inn,3,Design Flaws/Lack of Privacy
3042,kN,"It is dark in the hallways, dark in the rooms. I understand the point of trying to be trendy, but I kind of like the idea of seeing if the room is clean or not.  This former Days Inn, next to a construction site for the next year btw, has small rooms and a bar that pretends to be trendy. W was hot in the early part of this century, but seems more vegas than anything else. Too many other hotels in Chicago that are better than this one.",2,3,1,1,Negative,dark hallway dark room understand point trying trendy kind idea seeing clean former day inn next construction site next year btw small room bar pretend trendy hot early part century seems vega anything else many hotel chicago better,4,Noise/Atmosphere Problem
3056,FtM77Eyw860CeEv4Atmarw,"Every W Hotel Sucks unless you're a ""hipster"". I got a room here off priceline. It was hipster hell. I would never stay here again even with a gun held to my head.",1,1,1,2,Negative,every suck unless hipster got priceline hipster hell never even gun held head,5,Price/Fees/Poor Value
3057,NFBKg4LhHy7sRFrtBGkvJg,"Lounge area is cool but I've seen it before, it's nothing new...rooms are SO outdated and that god awful tacky shutter window looking into the bathroom...I get what they're trying to do but it ain't workin!..it just seems silly to me and like it's trying too hard.. I dunno..the W was cool back in the early  early 2000's... there are far more cooler, nicer, hipper, newer hotels in Chicago  I'd stay before here.  And the hallways were dark and dingy. The W is for two type of folks....20-somethings OR Married folks who have been out of the scene for a LONG time, lives in the burbs with 3 kids, rarely goes out and are totally clueless about what is hip these days, so they come to the W because of the name.... And I'd be willing to bet they go to Howl at the Moon, The lodge and Dicks last Resort for a fun night out.",2,3,3,4,Negative,lounge area cool seen nothing new room outdated god awful tacky shutter window looking bathroom trying workin seems silly trying hard dunno cool back early early far cooler nicer hipper newer hotel chicago hallway dark dingy two type folk somethings married folk scene long time life burbs kid rarely go totally clueless hip day come name willing bet howl moon lodge dick last resort fun,4,Noise/Atmosphere Problem
3058,2QWAjWVKojWWMBg2UEwA-Q,"I've stayed at aLoft hotels in the past, and always wanted a chance to stay at the chain on which the aLoft concept is based. Lots of glitz and glamor, lots of hip and trendy-looking architecture and amenities (showers without doors, flat-screen TV's, etc.); but overall the service was no better than comparable hotel chains. The best feature of this hotel is its location. The views of Lake Michigan and Navy Pier are spectacular. W Hotels seem to attract a certain clientele. Young, ""hip,"" narcissistic, club-hopping Gen Y alcoholics. To be fair, it may have been this location, but I felt like I was at a meat market. Plus, I was awakened at 3:00am one night by a large and loud group of people looking to ""continue the party"" in someone's room next door to me. So if you just need a place to stay during business meetings, this W isn't worth all the pretentiousness. Any of the Kimpton hotels in the area offer much better value (and much better personal service) for the price. But if hip and trendy is important, if you want to see and be seen, W could be for you. But I won't be back... at least voluntarily.",2,2,0,0,Negative,aloft hotel past always wanted chance chain aloft concept based lot glitz glamor lot hip trendy looking architecture amenity shower without door flat screen etc overall service better comparable chain best feature location view lake michigan navy pier spectacular hotel seem attract certain clientele young hip narcissistic club hopping gen alcoholic fair may location felt meat market plus awakened large loud group people looking continue party someone next door need business meeting worth pretentiousness kimpton hotel area offer much better value much better personal service price hip trendy important want see seen back least voluntarily,5,Price/Fees/Poor Value
3059,0bcuMM65LKDZ8tyYUd07Ag,"I have in fact stayed at some great W Hotels...this is NOT one of them. I may be from Hollywood, but save the game of Dr. Jekyll and Mr. Hyde for someone else...thanks but NO thanks! Let me start off by saying that this is my first ever Yelp review (first of many to come)...the sad part is that such a horrible experience is provoking my first motivation to actually critique a hotel establishment. I'll keep it short and sweet. I travel on a weekly basis for work and pleasure, have stayed in both fantastic and terrible hotels around the world. No story is necessary...when I fly across the country from LA on a weekly basis, I would like to arrive with first class treatment late on a Friday evening after a long work week, especially at $400 per night. Customer service is most important, and non-existent at this establishment (as pointed out by previous Yelpers). Even when I had a ""good"" stay in weeks prior, service was mediocre, room service blah, bar service...yikes. Oh, and hotel staff at the front should probably know a little something about the surrounding area, restaurants, etc...despite the fact that visitors can see the shadows of Navy Pier from their windows between the lake fog and the windy rain, a little ""local knowledge"" may go a long way here. Save yourself the $$, there are too many other options in the city of Chicago...when weather permits, you can walk to the lake from many other better options!",1,0,0,0,Negative,fact great hotel may hollywood save game jekyll hyde someone else thanks thanks let start saying first ever yelp review first many come sad part horrible experience provoking first motivation actually critique establishment keep short sweet travel weekly basis work pleasure fantastic terrible hotel around world story necessary fly across country weekly basis arrive first class treatment late friday evening long work week especially per customer service important non existent establishment pointed previous yelpers even good week prior service mediocre service blah bar service yikes staff front probably know little something surrounding area restaurant etc despite fact visitor see shadow navy pier window lake fog windy rain little local knowledge may long way save many option city chicago weather permit walk lake many better option,3,Design Flaws/Lack of Privacy
3067,gjtrzPQ2ooGf48JoOYm6tg,"The hotel is decent: nice decor, comfortable rooms, beautiful view.  Unfortunately the staff is rude and incompetent. In short: I paid for a room filled with flowers, they did not deliver the flowers.  The next morning they promised to refund my money and send a make-up bouquet to my wife.  A month later, after three reminders, they sent the bouquet (with a blank card).  A week after that their staff said everything was my fault.  They have still not refunded my money.  My credit card did the dirty work and charged back the flowers. Again: nice hotel, just avoid the concierge.",1,1,0,1,Negative,decent nice decor comfortable room beautiful view unfortunately staff rude incompetent short paid filled flower deliver flower next morning promised refund money send make bouquet wife month later three reminder sent bouquet blank card week staff said everything fault still refunded money credit card dirty work charged back flower nice avoid concierge,2,Cleanliness/Wear/Poor Upkeep
3068,IP8dZDuUZxS,"W Lakeshore is LOUD and OBNOXIOUS.  It is NOT hip and cool, although it tries to be.  Stay somewhere else, folks.  Not worth it. Just back from weekend trip to Chicago - although decor was nice/modern, bad management decisions made for a negative overall experience - loud music blaring in lobby/elevators, parties going on every night in the lobby, room service wakes you up at 8am.  Free Acura Experience is a joke - always constantly booked, never had the chance to try it. Hotel is perfect for 22 year old frat kids who want to get drunk, scream, run around all night picking up strippers.  For everyone else, an awful experience is sure to be had here.",1,1,1,0,Negative,lakeshore loud obnoxious hip cool although try somewhere else folk worth back weekend trip chicago although decor nice modern bad management decision made negative overall experience loud music blaring lobby elevator party going every lobby service wake free acura experience joke always constantly booked never chance try perfect year old frat kid want drunk scream run around picking stripper everyone else awful experience sure,4,Noise/Atmosphere Problem
3072,NmtlLT9ePbWvi0jCAhMYNw,"I attended an event at the W this week. The catering was not great. The staff was friendly but the passed apps were sub par. Everything that was supposed to be warm was cold and vice versa. The crab cakes were so bad I had to run to the bar so I could get something to wash the taste out of my mouth.   The hotel itself is geared to the trendy so if that's not your speed this probably isn't your hotel. I have enjoyed the Wave restaurant for dinner however, which has a great atmosphere and nice views of the lake. The food was good but not memorable.",2,1,0,0,Negative,attended event week catering great staff friendly passed apps sub par everything supposed warm cold vice versa crab cake bad run bar something wash taste mouth geared trendy speed probably enjoyed wave restaurant dinner however great atmosphere nice view lake food good memorable,3,Design Flaws/Lack of Privacy
3074,tGf9-,"My recent stay at this hotel was *terrible*.  The hallways were dirty, the room was in terrible disrepair, with paint chipped on the tables, threads hanging loose on the lampshades, the headboard falling off the wall, and dust on the desk supplies.  The room as a whole was small and cave-like. The worst experience though, was with the staff, one of whom tried to enter the room while I had the ""do not disturb"" sign up. (thank god for the chain!)  I was really shocked at the really poor quality of such a high-priced hotel, and will never be staying there again.",1,1,0,0,Negative,recent terrible hallway dirty terrible disrepair paint chipped table thread hanging loose lampshade headboard falling wall dust desk supply whole small cave worst experience though staff tried enter disturb sign thank god chain really shocked really poor quality high priced never staying,4,Noise/Atmosphere Problem
3089,CTzayCiBbl5p84zCqVc6Fg,"Hotel has a pretty nice lobby/bar area and the room was nice, great view of the lake and navy pier.   Problems:  Parking is $52.00 a day which is outrageous, lots right next door charge nearly half that.  Internet connection costs 14.95/day per device.  So if I wanted to connect my laptop and my phone to the wireless in my room that would be almost $30.00 a day!  When a standard room is $175.00 gotta make these other amenities cheaper.  Even if I just used one device, $14.95 a day?  The connection wasn't even that fast. If these things wouldn't bug you however, I would still recommend the hotel if you're looking for a great lakeshore view with modern decor",2,0,0,0,Negative,pretty nice lobby bar area nice great view lake navy pier problem parking day outrageous lot right next door charge nearly half internet connection cost day per device wanted connect laptop phone wireless almost day standard gotta make amenity cheaper even used device day connection even fast thing bug however still recommend looking great lakeshore view modern decor,5,Price/Fees/Poor Value
3093,acebit3QGPRW1gD-VoqFCg,"I attended a corporate event here and had a good time. However, the prices should NOT just be about location. The W seems to be an old, rundown hotel they took and tried to gussy up. My friends' room had scuff marks on the walls, cheap wood (or press board?) paneling nailed to one wall, and it was TINY. The bathrooms have a window, which is not only weird, but provide NO sound barrier. Pretty awkward, depending on who you're staying with. The shower heads are low and her husband almost wasn't able to fit under them! The bamboo blinds were also filthy. When you enter the room, you are greeted with a basket of goodies. Wow! Now, this helps to explain the $300ish for a crap room rates... or maybe not. We soon realized that next to this basket of ""goodies"" was a price list. An individual can of Pringles? $5! You can also buy 3 or 4 condoms for $12 and a ""Take me Away"" CD for $13. Wow. sexy, huh? Not really. Oh- and if you want anything that isn't in your room (towels, food, etc.) it's a $3.50 DELIVERY CHARGE and a 20% service fee. Wow. The 33rd floor (I believe it's called the Altitude Room?) is pretty nice, but the bathrooms have no main door. Again... awkward. The stones in the sink were pretty cool though, I have to admit. I would never, EVER pay to stay here, but people seem to like it. I guess when you have money to throw into the air at mediocre service and rooms, it's worth it.",2,0,0,0,Negative,attended corporate event good time however price location seems old rundown took tried gussy friend scuff mark wall cheap wood press board paneling nailed wall tiny bathroom window weird provide sound barrier pretty awkward depending staying shower head low husband almost able fit bamboo blind filthy enter greeted basket goody wow help explain ish crap rate maybe soon realized next basket goody price list individual pringles buy condom take away wow sexy huh really want anything towel food etc delivery charge service fee wow floor believe called altitude pretty nice bathroom main door awkward stone sink pretty cool though admit never ever pay people seem guess money throw air mediocre service room worth,1,Service Breakdown/Attitude
