Unnamed: 0,reviewID,reviewContent,rating,usefulCount,coolCount,funnyCount,sentGroup,cleanReview,dominantTopic,topicLabel
4285,4svdunJFOX5ytePIJ7XlQg,"I will not stay here if we go to Chicago again. Rooms are dark and need updating. Bathrooms are well lit but tiny. You can hear EVERYTHING   Seems like the walls are made of paper.  I knew every time our neighbors went to the restroom & when they left.  Lobby is beautiful but does not reflect the quality of the rooms. However, the sheets & bedding were clean & nice (the only reason I gave 2 stars). don't stay here.",2,0,1,0,Negative,chicago room dark need updating bathroom well lit tiny hear everything seems wall made paper knew every time neighbor went restroom left lobby beautiful reflect quality room however sheet bedding clean nice reason gave star,4,Noise/Atmosphere Problem
4289,DOHI5lrS,"Do not stay there. Service was rude, they only provided a smoking room, refused to provide a non-smoking room, rooms were knob & tube, no free bottles of water, expensive food downstairs, and overpriced on the whole.",1,0,0,1,Negative,service rude provided smoking refused provide non smoking room knob tube free bottle water expensive food downstairs overpriced whole,3,Design Flaws/Lack of Privacy
4296,22q7Qrv7JuibIfC5IdGHyg,"Treat me well and I'll come back. Treat me bad and I'll yelp on you! Find somewhere else to stay. At check-in, I was lucky enough to be helped by an arrogant, entitled gentleman who didn't find it worthy of his time to share with me how I could find my room, where the pool was or even how to access the elevators. I couldn't even get the jerk to smile.  I didn't think much of it until I was checking out (more on that later) and heard another staff member graciously and cheerfully speak to patrons. Now, I have a lot of respect for housekeeping staff. They undoubtedly work very hard... but what I did not appreciate was 1) how late the rooms would be cleaned. I got back to my room at 4pm once and it was still in the state that I left it in 2) when I would leave my room in the mornings, how my housekeeper would ask me if I wanted my room cleaned. When I answered yes, she had to make sure I was certain of my decision and would then be disappointed. What the hell?! I get that it would be nice to have one less room to clean, but isn't that your job? 3) noisy and inconsiderate staff. Because the walls are paper thin at this hotel, I could hear EVERYTHING going on in the next room.... including the HUGE fuss the staff made about the room next door... at 7:30AM!!!!!!! Apparently, when my neighbors checked out of their room, they left behind quite a bit of broken glass and furniture. The staff cleaning up IN the room thought it appropriate to YELL OUT to other team members down the hall to come see the wreckage. I could distinctly hear the chatter, the furniture being moved around and even the noise coming from their walkie-talkies.... all at such an ungodly hour. Unforgivable. Plumbing was a nightmare. Not only was the flow from the shower head poor, but, if a housekeeper was cleaning next door and turned on the water there, my water pressure got even lower!!!! Did I mention that the bathroom is tiny?! Don't rock back and forth as you brush your teeth - you might just fall into the toilet! So here's my biggest gripe....an hour before check-out, I review my invoice and there's clearly an erroneous charge. I never dined in the hotel's restaurant. I try reaching the front desk SIX TIMES and no answer. I ask concierge to connect me and still no answer. Finally, 15 minutes later, I try again and get a live person on the phone. I explain that I never dined at the restaurant. No problem, he says, he'll remove the charge. Says I need to come down to pick up a new invoice.  I gather my belongings, head downstairs. A new staff member prints out my invoice and the charge is still there. I contest it and make reference to my call earlier. This dude says that there's nothing that can be done. In fact, because I didn't get the name of the person who said he'd waive it, I'm stuck. The charge needs to be ""investigated"". So hold on... I just spent over $900 staying at your hotel and you're gonna squabble with me for $17?!  Of course, I asked to speak to the manager. So Ms. Rasha comes out and says I should go home. If the charge isn't legit, she'll credit my account. I tell her that's not going to fly with me. This is my company card and each charge needs to be substantiated. I know I didn't dine at the restaurant in the hotel. IN FACT, I wasn't even at the hotel at 9:30pm last night. So she tells me, that 9:30pm must have been when the charge posted, I must have eaten there earlier and just simply forgot. ARE YOU KIDDING ME?!?!? I tell her no, I haven't dined at their restaurant PERIOD. She offers to go through last night's receipts and get this, if the name on the receipt matches mine, I have to pay for the dinner. Why would I try to get out of a $17 charge if I had actually authorized it?!  She says to come back after 30 minutes. I go back after 45 minutes, and a new staff member tells me she's still looking through receipts. Fine. I go make myself useful and come back 25 minutes later.  The new staff member goes into Rasha's office, comes out, and prints me a new invoice without the charge. No explanation. No apology. Nothing.  I asked her what happened and she says ""The manager removed the charge. It was posted to the wrong room.""   Does the manager not know anything about customer service? Does she not have the human decency to come out and tell me this in person after she had me wait over an hour?  I ask her to call out Rasha and the latter comes out with an indignant look on her face. I tell her that I'm appalled by her customer service and thank her for inconveniencing me. Her reply? ""You're welcome"".",1,4,1,1,Negative,treat well come back treat bad yelp find somewhere else check lucky enough helped arrogant entitled gentleman find worthy time share find pool even access elevator even jerk smile think much checking later heard another staff member graciously cheerfully speak patron lot respect housekeeping staff undoubtedly work hard appreciate late room cleaned got back still state left leave morning housekeeper ask wanted cleaned answered yes make sure certain decision disappointed hell nice less clean job noisy inconsiderate staff wall paper thin hear everything going next including huge fuss staff made next door apparently neighbor checked left behind quite bit broken glass furniture staff cleaning thought appropriate yell team member hall come see wreckage distinctly hear chatter furniture moved around even noise coming walkie talkie ungodly hour unforgivable plumbing nightmare flow shower head poor housekeeper cleaning next door turned water water pressure got even lower mention bathroom tiny rock back forth brush teeth might fall toilet biggest gripe hour check review invoice clearly erroneous charge never dined restaurant try reaching front desk six time answer ask concierge connect still answer finally minute later try live person phone explain never dined restaurant problem say remove charge say need come pick new invoice gather belonging head downstairs new staff member print invoice charge still contest make reference call earlier dude say nothing done fact name person said waive stuck charge need investigated hold spent staying gonna squabble course asked speak manager rasha come say home charge legit credit account tell going fly company card charge need substantiated know dine restaurant fact even last tell must charge posted must eaten earlier simply forgot kidding tell dined restaurant period offer last receipt name receipt match mine pay dinner try charge actually authorized say come back minute back minute new staff member tell still looking receipt fine make useful come back minute later new staff member go rasha office come print new invoice without charge explanation apology nothing asked happened say manager removed charge posted wrong manager know anything customer service human decency come tell person wait hour ask call rasha latter come indignant look face tell appalled customer service thank inconveniencing reply welcome,3,Design Flaws/Lack of Privacy
4297,7JJGlZx88CfK1UEYM2QlfQ,"Oh how I wanted to enjoy my stay at this historical Chicago hotel. I really hate to write a negative review of this place, but I call it like I see it. My wife booked our room on http://priceline.com. That was probably our first mistake. We ended up getting a room that was fit for a stowaway on the Titanic. Our section of the hotel must have been undergoing renovations, because it was dark, dingy and not well maintained. Our room was small with a beautiful view of the fire escape and alley. To make matters worse, they gouge you for a $10 fee to use the fitness room. Not cool at all. I'm sure the Palmer house was the picture of elegance in the 50's. Unfortunately, the part of the hotel they stuck us in was dingy, poorly lit and outdated. I guess they treat their http://priceline.com customers differently. I doubt if I would ever book another room or even recommend the hotel to my out of town friends. Yes! It was that bad.",2,4,2,4,Negative,wanted enjoy historical chicago really hate write negative review call see wife booked http priceline com probably first mistake ended getting fit stowaway titanic section must undergoing renovation dark dingy well maintained small beautiful view fire escape alley make matter worse gouge fee use fitness cool sure palmer house picture elegance unfortunately part stuck dingy poorly lit outdated guess treat http priceline com customer differently doubt ever book another even recommend town friend yes bad,4,Noise/Atmosphere Problem
4298,iffeAFvLpFi8kdvcCzfSxQ,"Oh Palmer House, you seductive temptress. Look at this location!  Look at this building!  I want to die every time I go into the lobby it is so beautiful.   Ahh, but this is how they suck you in!  And how it just masks the greatly unfortunate experience from then on. Twice I had someone new at Registration.  And both times, instead of finding out the correct information, they tell me something completely different and wrong and completely waste my time. (1st time was in trying to get approval for me to check in without husband present, whose name was on the reservation.  2nd time I asked about a mailbox, because my letter was too large to fit in the mail chute on my floor. But to be fair, when I went to someone who knew what they were doing about my check in issues, it was fixed immediately.) So check in is at 3, right?  Exhausted,  I get to the room, throw down the bags, and call room service for a pot of coffee. Room service is ""closed"" until four. But the helpful pre-recorded message assures me that the restaurant downstairs, Lockwood, would definitely be able to help me!  I call Lockwood.  The chick on the phone says ""yep, come on down and get your coffee here"".  Oh, OK thanks, but I can just go to Starbucks for that?  Why would you have any service unavailable at the same time you have people checking in?   And speaking of the room.  I was ""upgraded"" because of the mix up at check in. My upgrade was to a small room that would have been beautifully decorated in 1990, complete with a large armoire that held a tube TV.  My view was of a fire escape (and most likely the alley below but I was too high up to see that far down.) Quite a bit different than the rooms they promote on the website.   I decide to check out the fitness center.  This is on a lower level, but when the elevator doors opened you would think you were in a completely different hotel.  Beautiful, modern decor in chocolate, greens and peacock blue.  The fitness center looks like a spa from the outside.  There is a woman at a desk who asks you to sign in.  Just as my pen hovered over the paper she adds ""Oh and by the way there is a $10 charge per day to use the facilities"".  Wait...what?  Are you serious?  Gah!  No thanks.   I just feel like my entire stay was non-stop irritation.  Are hotels the new airlines where the idea of service is dead and you are nickel and dimed to death?  I guess so, at least in the Palmer House.  Such a very serious let down.",2,6,2,1,Negative,palmer house seductive temptress look location look building want die every time lobby beautiful ahh suck mask greatly unfortunate experience twice someone new registration time instead finding correct information tell something completely different wrong completely waste time time trying approval check without husband present whose name reservation time asked mailbox letter large fit mail chute floor fair went someone knew check issue fixed immediately check right exhausted throw bag call service pot coffee service closed four helpful pre recorded message assures restaurant downstairs lockwood definitely able help call lockwood chick phone say yep come coffee thanks starbucks service unavailable time people checking speaking upgraded mix check upgrade small beautifully decorated complete large armoire held tube view fire escape likely alley high see far quite bit different room promote website decide check fitness center lower level elevator door opened think completely different beautiful modern decor chocolate green peacock blue fitness center look spa outside woman desk asks sign pen hovered paper add way charge per day use facility wait serious gah thanks feel entire non stop irritation hotel new airline idea service dead nickel dimed death guess least palmer house serious let,4,Noise/Atmosphere Problem
4301,n5Oj-qPv1B8LnkOF45MgGA,"Let's run the numbers on the Palmer House: * 2 Hilton staff at the check-in desk * 6 dudes with walkie-talkies in $60 suits, pacing the lobby area and leering at customers * 20 minute wait to check-in Bravo Hilton. I'd suggest that a historic Chicago property deserves better.",1,4,1,1,Negative,let run number palmer house hilton staff check desk dude walkie talkie suit pacing lobby area leering customer minute wait check bravo hilton suggest historic chicago property deserves better,1,Service Breakdown/Attitude
4302,Z5TMUHIT3-WZqCR-xAIEDA,"Giving this hotel only two stars breaks my heart. I have a big old soft spot for the Palmer House, as it was the hotel I stayed in on my first trip to Chicago nearly 20 years ago. Back then I thought it was the most luxurious hotel in the world and will always remember that trip fondly. So I was excited to go back, and there were elements of my stay that lived up to my great memories. Fabulous location. Gorgeous lobby and common areas. Unfailingly polite and cheerful service from check-in to room service to housekeeping. Good-sized, relatively quiet room on a high floor. Nice lounge with tasty drink selections. Three big disappointments, though: 1. My room, albeit spacious, was tired and dated. I was surprised at how annoying it was to have an old tube TV stashed away in an inconvenient armoire instead of a flat screen on a more accessible bureau-top. 2. Hotel wireless was expensive and slow. I don't mind paying extra for premium wireless service, provided I actually GET premium wireless service. But I didn't see any real difference in what I got for my $19.99 at the Palmer House than I would for free at any Courtyard by Marriott. 3. But the real reason for the two-star review: My bathtub was a deathtrap. I am not kidding. The liner had separated from the tub frame and was all warped and spongy, so every morning it felt like I was taking a shower on a trampoline. It kept me so off balance I had to shampoo with one hand while clinging to the soap dish with the other. I could not imagine being an elderly person trying to navigate that dangerous enclosure. It's a wonder someone has not fallen, broken a hip, and sued them. My colleague, who has more Hilton points than I, stayed on one of the renovated floors and told me his room was really nice. He also snuck me into the concierge lounge, which was very comfortable and served up great wines and tasty hot and cold appetizers. So maybe the moral of the story is...stay at the Palmer House but on a concierge floor. That's a solution I could live with.",2,1,2,0,Negative,giving two star break heart big old soft spot palmer house first trip chicago nearly year ago back thought luxurious world always remember trip fondly excited back element lived great memory fabulous location gorgeous lobby common area unfailingly polite cheerful service check service housekeeping good sized relatively quiet high floor nice lounge tasty drink selection three big disappointment though albeit spacious tired dated surprised annoying old tube stashed away inconvenient armoire instead flat screen accessible bureau top wireless expensive slow mind paying extra premium wireless service provided actually premium wireless service see real difference got palmer house free courtyard marriott real reason two star review bathtub deathtrap kidding liner separated tub frame warped spongy every morning felt taking shower trampoline kept balance shampoo hand clinging soap dish imagine elderly person trying navigate dangerous enclosure wonder someone fallen broken hip sued colleague hilton point renovated floor told really nice snuck concierge lounge comfortable served great wine tasty hot cold appetizer maybe moral story palmer house concierge floor solution live,2,Cleanliness/Wear/Poor Upkeep
4314,dJX4W7-KSVb471VjuPkLEQ,"Random fact: the Aflac duck & the three Budweiser penguins stayed at the Palmer House. My company's annual meeting was being held in Chicago this year at the Palmer House.  Unfortunately, our staff would be split between two hotels.  I was one of the lucky ones who got to stay at the Palmer House...or so I thought... Being a Hilton hotel, I expected so much more from the Palmer House.  I looked at their beautiful rooms on the internet and upon checking in noticed that they received a plaque for being a historic hotel.  Apparently, it being a ""historic"" hotel only meant it was old and creepy. LOBBY: Absolutely beautiful! The walls and ceiling has such amazing and elegant detail.  However, note that the lobby is located on the second floor. ROOMS: My room did NOT look like the rooms on their website and felt quite cold and creepy.  I walked into an outdated room the size of a large closet or tiny bedroom with a double size bed.  Who still has double beds?!   The edge of the bed was extremely close to a door that opened to a tiny closet that had a safe, iron, and ironing board.  My coworkers and I compared the bathrooms to something you might see out of a horror movie like The Shining.  There was also a TUBE tv.  Free internet?  Nope, they charge...and there isn't wireless internet, you need to use an Ethernet cable. LOCATION: A block or so from Millennium Park (home of the bean) Close to the Blue (Monroe Street exit) and Red (Adams Street exit) train lines A block from State Street shopping area Do yourself a favor, spend the extra money for one of the hotels located across the river.  You'll probably be a lot happier.",2,1,0,0,Negative,random fact aflac duck three budweiser penguin palmer house company annual meeting held chicago year palmer house unfortunately staff split two hotel lucky one got palmer house thought hilton expected much palmer house looked beautiful room internet upon checking noticed received plaque historic apparently historic meant old creepy lobby absolutely beautiful wall ceiling amazing elegant detail however note lobby located second floor room look room website felt quite cold creepy walked outdated size large closet tiny bedroom double size bed still double bed edge bed extremely close door opened tiny closet safe iron ironing board coworkers compared bathroom something might see horror movie shining tube free internet nope charge wireless internet need use ethernet cable location block millennium park home bean close blue monroe street exit red adam street exit train line block state street shopping area favor spend extra money hotel located across river probably lot happier,2,Cleanliness/Wear/Poor Upkeep
4315,5PUJTqSX,"Rooms are super small and the service is eh... I've stayed at quite a few hotels and this one got me irked enough to jump on Yelp for a review. (1) I called before my flight to put my wife on the reservation since I was coming in 4 hours after her. They assured me this was done even after I asked them how they would do it since they didn't ask for her name. They take the name but I am skeptical. I land in Chicago and sure enough, my wife has been wandering around in 30* weather like a hobo in California clothing. They apologize but that's about it. (2) The guy at the desk was a smart ass. He asks for my ID, I give it to him. He then asks if I go by an alias, I tell him I use my nickname (DJ R***) often (my name is D*** R*** Jr). He finally says, OK, why are you using a different name? I'm a nice guy and will accept it, but most hotels will not. Really? I've been traveling frequently for the better part of 10 years and have never had a problem. (3) I get to the room and damn near hit the bed with the door... THE ROOM IS THAT SMALL. Heel to toe (size 13 show) 4 steps to the door from the bed and 1.5 steps from the wall to the bed on the other side. ARE YOU SERIOUS? Yeh, they put a desk but it's so close to the foot of the bed that it's more intrusive than useful. There is a dresser and TV but it's tucked in a corner rendering the TV unwatchable. (3) The bathroom is tiny and using the toilet necessarily puts you into the wall. When I got here, I immediately started looking at other hotels (like the Wit where I stayed a couple months ago) but was talked down by my exhausted wife. I wanted to complain and probably will... never again Palmer House, never again.",1,2,0,0,Negative,room super small service quite hotel got irked enough jump yelp review called flight put wife reservation since coming hour assured done even asked since ask name take name skeptical land chicago sure enough wife wandering around weather hobo california clothing apologize guy desk smart as asks give asks alias tell use nickname often name finally say using different name nice guy accept hotel really traveling frequently better part year never problem damn near hit bed door small heel toe size show step door bed step wall bed side serious yeh put desk close foot bed intrusive useful dresser tucked corner rendering unwatchable bathroom tiny using toilet necessarily put wall got immediately started looking hotel wit couple month ago talked exhausted wife wanted complain probably never palmer house never,2,Cleanliness/Wear/Poor Upkeep
