Unnamed: 0,reviewID,reviewContent,rating,usefulCount,coolCount,funnyCount,sentGroup,cleanReview,dominantTopic,topicLabel
4444,eU-NwJNtGD68eK-YACELtw,"The front desk hostess: Michelle is HORRIBLE. I'd probably never come back to this place. When I was checking in, she says the only room available was a TWIN size bed and I looked at her dumbfounded. I obviously had another person with me, but she insisted that it's fine. I complained, and I instantly get a King size bed. Either she was lazy, or too dumb to operate a computer.",1,4,5,4,Negative,front desk hostess michelle horrible probably never come back checking say available twin size bed looked dumbfounded obviously another person insisted fine complained instantly king size bed either lazy dumb operate computer,2,Cleanliness/Wear/Poor Upkeep
4447,-x7rnsjOnHbZYas07n8RCg,"I've been here for a number of events and stayed here a few times and I must say, I am generally underwhelmed. The place is beautiful, that is for sure; a throwback to a time when fine hotels were majestic and grand and not modern and boutique: fresco ceilings in the lobby, gold trim, open bar and huge lobby.   The problem is twofold: it is aging and it is expensive for what you get.  The rooms have a old feel to them, but they are still quite old and small.  You don't get much room for your money and with so many great luxury hotels downtown, it is tough to make this the go-to choice.   Plus, the ample conference facilities means that the lobby is all jammed up with people from whomever the hotel is hosting that day. If you are going to stay in Chicago and want to blow ~$200/night on a hotel, I would stay elsewhere.",2,0,0,0,Negative,number event time must say generally underwhelmed beautiful sure throwback time fine hotel majestic grand modern boutique fresco ceiling lobby gold trim open bar huge lobby problem twofold aging expensive room old feel still quite old small much money many great luxury hotel downtown tough make choice plus ample conference facility mean lobby jammed people whomever hosting day going chicago want blow elsewhere,1,Service Breakdown/Attitude
4453,ovanybVW-XWGTtKh5xLlvQ,Margarita had a rotten lime to compliment the rotten waitress.  And whoever thought that blue cheese and spicy buffalo sauce was a good combo for a chicken sandwich should watch some food network--that's were I got my formal training ;). Too pricey for the quality. Never will return even if I got paid for it. Ew.,1,0,0,0,Negative,margarita rotten lime compliment rotten waitress whoever thought blue cheese spicy buffalo sauce good combo chicken sandwich watch food network got formal training pricey quality never return even got paid,5,Price/Fees/Poor Value
4456,7fsFseqysglS4GsaTrIdGw,"Small rooms. My wife and I had a room with two beds and it was still criminally small , AND both beds were less than a footfrom each other. The bathrooms are barely bigger than the laundry closet in my condo. Elevators are slower than Paul Konerko(we were here for Soxfest, hence the slow ballplayer reference), and hotel staff was clueless overall. Overpriced rooms, overpriced parking, overpriced room service, overpriced....well you get the picture. Dont bother. While it's 'pretty"" inside the lobby, it's a dump when you go to your room.",1,1,0,0,Negative,small room wife two bed still criminally small bed less footfrom bathroom barely bigger laundry closet condo elevator slower paul konerko soxfest hence slow ballplayer reference staff clueless overall overpriced room overpriced parking overpriced service overpriced well picture dont bother pretty inside lobby dump,5,Price/Fees/Poor Value
4463,TRQ5YjS2Kh9-Nyx8wlJDHw,"The lobby is beautiful. Other than that, this hotel kind of sucks. Our 14th floor room smelled *really* musty. The bedding would have been beautiful, except for the conspicuous stains on the throw pillows. One can only imagine... No coffee maker in the room! WTF? It was really loud as well. We asked for a room away from the elevator to avoid hearing people trekking in and out all night. But nonetheless, constant noise. And there was some mysterious whirring noise all night long that I think was an ice machine.  Luckily I brought ear plugs. The room looked nice, and the lobby was beautiful, but all-in-all, not a comfy stay at all.",2,1,0,0,Negative,lobby beautiful kind suck floor smelled really musty bedding beautiful except conspicuous stain throw pillow imagine coffee maker wtf really loud well asked away elevator avoid hearing people trekking nonetheless constant noise mysterious whirring noise long think ice machine luckily brought ear plug looked nice lobby beautiful comfy,4,Noise/Atmosphere Problem
4472,GsbPcu,"I must say that I was extremely disappointed with my stay at the Palmer House. Upon first entering the lobby of the hotel, I was very impressed. The ambiance is one of elegance and the presentation was amazing. I was very excited to complete the check-in process and make my way to my room. I knew that there was something strange upon check in - the representative said something about me being in a suite and how that was too large for one person. He then proceeded to downgrade my reservation to a standard room despite my assertion that I did not want to make that change. Dismayed with the check in process I made my way to my room which only increased my frustration with the hotel. The room was small, very small. Although the hotel had recently been renovated, the impression I got was that not much thought had been put into the design/layout of these rooms. The bathroom was terribly small. The toilet was the centerpiece of the room and from there you could adjust the water in the shower or do your hair in the mirror. Okay, so maybe that is a bit of an exaggeration but not much. The only redeeming quality about this room was that the bed was comfortable and clean. Of note - the hotel did not offer wireless internet, the elevators were very slow, and none of the staff seemed overly friendly or engaged. Furthermore, while dining at their main restaurant, I had to wait nearly an hour to get a check after our server went missing. In summary, this will be my first and my last stay at the hotel. If you're only requirement is an impressive lobby, this is the place. If you are looking for comfort and service, I'd recommend you book elsewhere.",2,0,0,0,Negative,must say extremely disappointed palmer house upon first entering lobby impressed ambiance elegance presentation amazing excited complete check process make way knew something strange upon check representative said something suite large person proceeded downgrade reservation standard despite assertion want make change dismayed check process made way increased frustration small small although recently renovated impression got much thought put design layout room bathroom terribly small toilet centerpiece adjust water shower hair mirror okay maybe bit exaggeration much redeeming quality bed comfortable clean note offer wireless internet elevator slow none staff seemed overly friendly engaged furthermore dining main restaurant wait nearly hour check server went missing summary first last requirement impressive lobby looking comfort service recommend book elsewhere,2,Cleanliness/Wear/Poor Upkeep
4482,LZhYfjylCTo6x5TjjsKwbQ,"This is a very historic hotel that caters to the well off. My personal experience was interesting & rewarding yet unsatisfying. Obviously I have special needs with my disability yet the job to accommodate that was feeble at best. The bathrooms are small and few & difficult to navigate. There are even stairs and NO ramp to one of the main lounges featured bar. Top it off this is the downstairs.. Now Imagine how bad the rooms are for the disabled. They charge for everything.... the wifi even in the main lobby has a ridiculous fee. Lets not even get me started with the parking... LOL With the ""rich history"" comes a lack of vision toward the future. The atmosphere was stimulating & stuffy. The people were down to earth but yet on another planet. The staff where great, but that is what you expect for such a pricey hotel. Food was good but pricey as where the drinks. Location was well what can I say it is the tourist center of downtown.",2,0,0,0,Negative,historic caters well personal experience interesting rewarding yet unsatisfying obviously special need disability yet job accommodate feeble best bathroom small difficult navigate even stair ramp main lounge featured bar top downstairs imagine bad room disabled charge everything wifi even main lobby ridiculous fee let even started parking lol rich history come lack vision toward future atmosphere stimulating stuffy people earth yet another planet staff great expect pricey food good pricey drink location well say tourist center downtown,3,Design Flaws/Lack of Privacy
4489,8Dv1gGFDfeI7d3Z,"My friends and I attended the New Year's Eve party here yesterday. I had never been inside the place before then but had heard great things about it from friends. The lobby area is very ornate and elegant. It literally feels like you're walking into a gold mine or something. The rooms are a different story, however. It was very small, the beds were full size, which is something I had never seen in a [Hilton] hotel before. The bathroom has the be the smallest bathroom I've ever seen in my entire life. One person couldn't really be in there comfortably, forget about having two! Motel 6 has bigger bathrooms than this. The lighting is super poor and the view was terrible. What really turned me off was the staff at the hotel did not allow alcohol in the rooms. They made up some BS about licensing agreements and other legal mumbo jumbo, but really it was just an excuse for them to get more money out of people, because they said if they found alcohol in a room they were going to charge a ""cork fee"" of $60 per bottle. So, you're meaning to tell me that after already paying for a night in your hotel, plus paying to go to the party, you're going to charge me for having liquor that I PAID FOR MYSELF??? I don't think so! If I come back here, it won't be to stay. The event itself was very nice and the restaurants and lounges seemed posh, so I'd come back for those.",2,0,0,0,Negative,friend attended new year eve party yesterday never inside heard great thing friend lobby area ornate elegant literally feel walking gold mine something room different story however small bed full size something never seen hilton bathroom smallest bathroom ever seen entire life person really comfortably forget two motel bigger bathroom lighting super poor view terrible really turned staff allow alcohol room made licensing agreement legal mumbo jumbo really excuse money people said found alcohol going charge cork fee per bottle meaning tell already paying plus paying party going charge liquor paid think come back event nice restaurant lounge seemed posh come back,2,Cleanliness/Wear/Poor Upkeep
4490,7dzdQCI4B7suRSossM0QTw,"I stayed here for business, and I was assigned an oversized closet of a room with a full bed. It was the smallest room ever. I complained to the front desk and so they gave me a double room instead, which was considerably larger. I stayed here while they were renovating so the rooms were outdated and weren't the best.",2,2,1,1,Negative,business assigned oversized closet full bed smallest ever complained front desk gave double instead considerably larger renovating room outdated best,2,Cleanliness/Wear/Poor Upkeep
4495,P,"We decided to try out the spa and were very disappointed in the staff, the services we received, and the set up. First off we were asked to change our appointment for a scheduling conflict. There was no conflict, there was no one there, we had to wait for staff to arrive. Be warned, if you want to ""steam"" first, the steam room is on another floor, and you may burn yourself if the steam has been turned too high. We both ordered the same service but received different treatments that were not consistent in time or  content. The staff all around could use some training in customer service,  staff were obviously in positions  above their ability, and were not professional about their business.",1,2,0,0,Negative,decided try spa disappointed staff service received set first asked change appointment scheduling conflict conflict wait staff arrive warned want steam first steam another floor may burn steam turned high ordered service received different treatment consistent time content staff around use training customer service staff obviously position ability professional business,3,Design Flaws/Lack of Privacy
4500,BKRKAAdsxJ4lXWMMvF5dAA,"Did I book the Palmer House on Hotwire- Yes! Did I get it for $100 on a Sat. night-  Yes!  I am not even joking this was the convo I had with the front desk guy. Stuff like this would only happen to Ben Stiller in meet the parents.  Me:  We are checking in.  Clerk:  We have the parlor room for you on executive level.  It comes with free breakfast.  Me: Sounds great.  Clerk:  The room doesn't have a bed in it. Me:  Wait .  .  . You are trying to give us a room without a bed in it.  Clerk:  it is a very spacious room, we could try and get a roll away for you.  Me:  uhhh.  . That's not going to work for us. Clerk:  that is the only room we have available.  Me: the only room you have doesn't have a bed.  You are going to have to try harder than that.  Clerk:  Well.  .  .how about a smoking room. Me: No- try again.  Finally normal room non smoking.  .  . And that jackwagon was trying to give us a room without a bed.  RIDICULOUS!!!!!",2,1,0,2,Negative,book palmer house hotwire yes sat yes even joking convo front desk guy stuff happen ben stiller meet parent checking clerk parlor executive level come free breakfast sound great clerk bed wait trying give without bed clerk spacious try roll away uhhh going work clerk available bed going try harder clerk well smoking try finally normal non smoking jackwagon trying give without bed ridiculous,2,Cleanliness/Wear/Poor Upkeep
4501,Umlp4n-GP0ld4JezuKGkxA,"Your lobby is georgous, but the table service sucks.  Lounging in the area between Lockwood and Potter's Lounge, I ordered a hot chocolate which arrived quickly enough, but when I tried to pay the lady, she said she'd come back.  She never did, even though other groups got their bills.  Trouble was, I was short on time and didnt have the patience for this shit, so I tried to track her down.  No luck.  Had to get the hostess at Lockwodd to find my bill, which by the way was almost $5.50.  For a small cup of hot chocolate and shitty service.  Go to hell.",2,1,0,2,Negative,lobby georgous table service suck lounging area lockwood potter lounge ordered hot chocolate arrived quickly enough tried pay lady said come back never even though group got bill trouble short time didnt patience shit tried track luck hostess lockwodd find bill way almost small cup hot chocolate shitty service hell,3,Design Flaws/Lack of Privacy
4503,VPIFHiF60e7T5JKql8TyxQ,"For one of the most expensive hotels in The Loop, I was very dissatisfied with the way I was treated when I went to check in.  The front desk said ""hello."" However, when he discovered that my reservation was through Priceline for a discounted rate, then the niceties ended.  Immediately he starts to upsell my father and I to suite on the executive level for an extra $80/night with lots of free amenities.  When we declined, he lowered the price to $50/night.  Keep in mind I was already paying $125/night through Priceline.  Knowing that my reservation was 2 persons, he stuck my Dad & I with a single person dorm room.  The room itself was barely bigger than the bed and there were no closets.  To add insult to injury, there were lots of normal sized 2 bed rooms that were empty.  I even verified this with the cleaning staff on the floor.  When I went back to the front desk  and spoke to the same rude person that check us in and asked to speak with a manager.  The manager would not speak to us, but conveyed to the front clerk that miraculously that there was a room with 2 beds available that was handicapped accessible.  The rooms was normal sized, but the windows were on 3 floor with no view because there was some metal structure blocking any daylight from coming into the room.  They also refused to change my room again even when said I give them a bad review online and they basically shrugged.  If you are paying $350/night, they are nice.  If you are paying a Priceline discount rate, they treat you like a second class citizen.",1,3,0,0,Negative,expensive hotel loop dissatisfied way treated went check front desk said hello however discovered reservation priceline discounted rate nicety ended immediately start upsell father suite executive level extra lot free amenity declined lowered price keep mind already paying priceline knowing reservation person stuck dad single person dorm barely bigger bed closet add insult injury lot normal sized bed room empty even verified cleaning staff floor went back front desk spoke rude person check asked speak manager manager speak conveyed front clerk miraculously bed available handicapped accessible room normal sized window floor view metal structure blocking daylight coming refused change even said give bad review online basically shrugged paying nice paying priceline discount rate treat second class citizen,2,Cleanliness/Wear/Poor Upkeep
4508,k1WmMKffLi167QNPUc-fuA,"I was SO excited to spend a night at the fabled Palmer House this past spring!  My place of business had rented a room there so some of us could get changed after preparing for an event on Michigan Avenue, and I decided to crash there overnight before heading home the next morning.  The room was small. Very small.  But, okay, the Palmer House has been there since, when?  the late 1800's?  So I'll excuse the size of the room.  Decorating? Gauche. And NO FAN in the BATHROOM!  Imagine three women trying to shower, change, do hair in a postage stamp room when there's no fan in the bathroom.  All of the mirrors were fogged over.  NOT good.   After the event, I was ready for a great night's sleep. It was around 12:30 when I crawled into bed. At 1:45, someone started banging on the door across the hall, and yelling for ""LaShonda"" to wake up.  this went on for about three minutes, and, just as I was about to call security, LaShonda got out of bed, opened the door, explained that she was drunk and had puked all over the place, and let the door banger in.  I fell asleep again at about 2:30.  At 4AM, the guy in the room next to me decided it was time to call Mike and see if they could ""get some women.""  Bill, the other guy in Mike's friend's room, kept saying, ""It's 4 o'clock in the morning."" But Mike's friend, apparently had a deep need for a woman.  I didn't know whether to call the front desk or yell through the wall the suggestion that Mike's friend and Bill go across the hall and get LaShonda.  After about ten minutes, I heard the door bang and Bill and Mike's friend headed out onto the mean streets of Chicago to look for women.  Then, at about 7, the families started trundling down the hall with their wheeled suitcases and squeaky-voiced children.  This eventful night at the Palmer House set my company back $321.  Maybe they have extremely nice suites available for more than that, with sound proofing that really keeps you from hearing about LaShonda's puking or Mike's friend's need for women, but I would not go back. Ever.  We complained to the management, and they were unmoved.  So, in this case, you get 'way less than you pay for. Does not live up to hype or its storied history.",2,1,0,1,Negative,excited spend fabled palmer house past spring business rented changed preparing event michigan avenue decided crash overnight heading home next morning small small okay palmer house since late excuse size decorating gauche fan bathroom imagine three woman trying shower change hair postage stamp fan bathroom mirror fogged good event ready great sleep around crawled bed someone started banging door across hall yelling lashonda wake went three minute call security lashonda got bed opened door explained drunk puked let door banger fell asleep guy next decided time call mike see woman bill guy mike friend kept saying clock morning mike friend apparently deep need woman know whether call front desk yell wall suggestion mike friend bill across hall lashonda ten minute heard door bang bill mike friend headed onto mean street chicago look woman family started trundling hall wheeled suitcase squeaky voiced child eventful palmer house set company back maybe extremely nice suite available sound proofing really keep hearing lashonda puking mike friend need woman back ever complained management unmoved case way less pay live hype storied history,2,Cleanliness/Wear/Poor Upkeep
4511,Fxzmw4Wy,"Small rooms, loud street noise from the El, old furnishings, and expensive ""extras"" make the Palmer House a plain rip off.  The lobby is impressive and gorgeous, and yes, some of the rroms  have been renovated, but I've been stuck in an older room for a week, which sucks.  Throw in another $18 for internet per day and another $18 per day for use of the health club and the cost adds up.  I would definitely look elsewhere!",1,1,0,0,Negative,small room loud street noise old furnishing expensive extra make palmer house plain rip lobby impressive gorgeous yes rroms renovated stuck older week suck throw another internet per day another per day use health club cost add definitely look elsewhere,4,Noise/Atmosphere Problem
4513,DARoIiapDmwYSoIljTz69w,"ok this is a fancy hotel, the decor and ambiance lives up to that. But what kind of place charges for internet access AND use of the fitness room? Seriously? No thanks.",1,0,0,0,Negative,fancy decor ambiance life kind charge internet access use fitness seriously thanks,3,Design Flaws/Lack of Privacy
4518,KKHCCnA6gaYCMbmztT-lww,"The hotel is billed as a four-star property. The room I stayed in last week did not have a fridge/mini-bar, no coffee maker or water heater of any sort, an old 23-ish inch CTR TV that could only muster a grainy image. Another great amenity was 7$/hr wifi in the lobby. Also, their famous brownie is not very exciting at all, skip it.",2,2,0,0,Negative,billed four star property last week fridge mini bar coffee maker water heater sort old ish inch ctr muster grainy image another great amenity wifi lobby famous brownie exciting skip,3,Design Flaws/Lack of Privacy
4521,8oh5buQJveM54Ipbez,"The hotel has a beautiful lobby. Very large. I think the ceilings in the lobby were at least 3 stories tall. Wonderful architecture. Very classy. Now to the rooms. I had a King room that I booked on Priceline. You don't get to select the type of room on priceline like you do on expedia, orbiz, or any other travel site, so I had to call to make sure I had a King room.  I was also told by a friend to ask for the more renevated room, which I was able to get, (I guess).  The room was very very small. the bed was about 6 or 7 feet from the door. The room had a desk and a chair, but no extra comfy chair. No dresser to store my clothing. The ice bucket and two glasses were stored in the closet because there was no room to put it. The flat screen tv was mounted on the wall but a whole in the wall where the cable comes from was right in the middle of the wall (tacky) including all the wires to the tv halfway hanging down from the tv. (tacky again).  The bathroom was ok, small but ok.     I order room service, a $12 cheeseburger and soda turned out to be $32 after state tax, city tax, room service fee, 18% gratuity for room service orders. And the guy acted like he wanted a tip when he brought in the tray. Seriously?? A soda in the vending machine was $2.50 and so was bottled water. Luckily there was a 7-elevan down the street for my late night cravings.     I put the do not disturb sign on the door because I wanted to sleep in late that next saturday morning. At 8am I am waken up by vacuuming by my door. Mind you the bed is close to the door. I felt like I was being punked. I guess do not disturb in only to keep the maids from knocking on your door. They didnt finish vacuuming the long azz hallway til and hour and a half later.     There was no view from my window, only the back fire escape and the building next to me.     I would never stay at this hotel or suggest anyone stay here.",1,0,0,2,Negative,beautiful lobby large think ceiling lobby least story tall wonderful architecture classy room king booked priceline select type priceline expedia orbiz travel site call make sure king told friend ask renevated able guess small bed foot door desk chair extra comfy chair dresser store clothing ice bucket two glass stored closet put flat screen mounted wall whole wall cable come right middle wall tacky including wire halfway hanging tacky bathroom small order service cheeseburger soda turned state tax city tax service fee gratuity service order guy acted wanted tip brought tray seriously soda vending machine bottled water luckily elevan street late craving put disturb sign door wanted sleep late next saturday morning waken vacuuming door mind bed close door felt punked guess disturb keep maid knocking door didnt finish vacuuming long azz hallway til hour half later view window back fire escape building next never suggest anyone,4,Noise/Atmosphere Problem
